Comentario,Upvotes,Sentimiento,Puntaje Sentimiento
"Gracias por hacer las cosas como las estás haciendo, si bien no eres perfecto estás formando a la persona que soy hoy en día. Y aunque no sea perfecto y justo ahora me siento como la mierda, me complace pensar que estás dando todo de ti y que eres feliz haciendo las cosas que te gustan. Aunque reflexionando tu también estás en la mierda y sigues  con una indiferencia casi inhumana, diría que eres más fuerte que yo o menos llorón, Pero supongo que el que no supieras manejar las emociones me dejó en este hoyo


Posdt: estúpido imbecil, ten cuidado por dónde pisas si hay clavos en el piso y mas si estás a oscuras",1,Negativo,-0.25
Menos mal que no sigues con la golfa esa,1,Negativo,-0.296
"Ese compa ya está muerto, nomás no le han avisado",1,Negativo,-0.296
POR FAVOR ANDATE DE AHI,1,Positivo,0.4019
"Que saque casa en el 2022. De todos modos ya en ese entonces estaban caras, pero no tanto como ahorita.",1,Negativo,-0.296
"Ten cuidado con lo que deseas, porque se acaba cumpliendo.",1,Neutral,0.0
"Sal de ahí.

Ella no te quiere. No disfruta ya de estar a tu lado. Miente y está saliendo con su amigo. Sí, ese que considera un hermano.

No lo intentes de nuevo. Sal. Tú sabes que hay señales.

Estar soltero no es tan malo.

Ah, y ni se te ocurra mandar a hacer el anillo. Obviamente no vas a recuperar lo que gastaste.",1,Negativo,-0.8402
El número de la lotería de ayer.,1,Neutral,0.0
No tienes idea de lo solo que estás.,1,Negativo,-0.296
compra bitcoin que va a subir en 100K,1,Neutral,0.0
Estoy 3 años más viejo,1,Neutral,0.0
Compra Bitcoin !!,1,Neutral,0.0
Quédate en Sevilla.,1,Neutral,0.0
"Invierte en Bitcoin, sp500 y vende en enero de 2025!!!!",1,Neutral,0.0
"Deja de perder tu tiempo en mamadas y ponte a estudiar, te arrepentirás si no lo haces.",1,Negativo,-0.296
¡Toma decisiones ya! No esperes a estar cien por ciento seguro. Te arrepentirás.,1,Negativo,-0.3595
"No hagas nada ilegal porque al final te van a atrapar y será un estrés, no estreses a tu novia te va a odiar y a pero al final se va a solucionar todo.
Pdt: no compres ese puto auto",1,Negativo,-0.6808
"Conoceras a una chica, quiero que la cuides, le demuestres lo especial que es para ti, y que le des todo tu cariño, quizás así evites su fatal destino....",1,Negativo,-0.5423
Ponte a hacer ejercicio,1,Neutral,0.0
Eso no es tan importante como tú crees,1,Negativo,-0.296
"Todavía no vas a tener pareja bro, ni te molestes.",1,Negativo,-0.296
Ey 👍,1,Neutral,0.0
"¡Comprá dólares, comprá dólares, comprá dólares!",1,Neutral,0.0
"Hey bruh, learn spanish so you can answer a reddit in 3 years.",1,Neutral,0.0
"Cuando la encuentres, aléjate de ella, antes de que sea demasiado tarde.",1,Neutral,0.0
Vas bien 👍,1,Neutral,0.0
No compres criptomonedas,1,Negativo,-0.296
"No vuelvas a esa empresa, da igual cuanto te ofrezcan.",1,Negativo,-0.296
Ahorrate el show y estudia ingeniería en software de una,1,Neutral,0.0
¡No te metas en NFTs imbecil!,1,Neutral,0.0
Suicidate,1,Neutral,0.0
Suicidate...,1,Neutral,0.0
Relax que todo llega,1,Positivo,0.4404
"**""BITCOIN""**",1,Neutral,0.0
Fome qliao,1,Neutral,0.0
No pruebes el criko,1,Negativo,-0.296
Concentrate y entrena fuerte,1,Neutral,0.0
Encontraras alguien en irl y no te rindas,1,Negativo,-0.296
Ya he encontrado el origen de tu dolor. Es una pena no haberlo visto hace más de quince años.,1,Negativo,-0.296
No te rindas,1,Negativo,-0.296
No vale la pena. Brinca,1,Negativo,-0.296
"Folla con esa puta, no esperes más",1,Negativo,-0.296
que deje de tragar y haga pesas. Que ahorre.,1,Neutral,0.0
No intentes traficar con personas ni evadas impuestos,1,Negativo,-0.296
Deja a Luis,1,Neutral,0.0
Ahorra so cabron,1,Neutral,0.0
"No pierdas el tiempo, las cosas solo empeorarán..",1,Negativo,-0.296
"Que siga adelante y que el arrepentimiento es parte de la vida, lo importante es hacerse cargo de los errores sin avergonzarse y que siempre puede dar más de si.
Pero más bien, la abrazaría. ☺️",1,Negativo,-0.5574
"No apuestes esos bitcoins bro, mejor vendelos y mete ese dinero a inversion.",1,Negativo,-0.296
"Y ya la habia cagado hace 3 años, necesito volver mas atras",1,Neutral,0.0
Estudia pelotudo,1,Neutral,0.0
"""Disfruta del viaje a Noruega y procura acostarte con una chica de allá o de otro país antes de que te frustres más de lo que ya estas.""",1,Neutral,0.0
"Run, Forest, run...",1,Neutral,0.0
"Hagas lo que hagas, no regreses con ella",1,Negativo,-0.296
"Que te valga verga lo que te diga tu mamá, esta es tu nueva vida",1,Neutral,0.0
No pagues la quincena de carpa en MDQ,1,Negativo,-0.296
Hecha más palos con tu ex,1,Neutral,0.0
No te enamores de la mamá soltera,1,Negativo,-0.296
"Deja la paja y la pornografía Hijo de putaaaaa!!!, es desgastador engancharse con eso.",1,Neutral,0.0
"En el fondo sabes muy bien que nadie es realmente tu ""amig@"" deja de ser tan ingenuo.",1,Neutral,0.0
Vende  toda tu casa y compra bitcoin,1,Neutral,0.0
"Todo lo bueno acaba, pendejo",1,Neutral,0.0
esta agustia va pasar kriño,1,Neutral,0.0
"Agarrate, se vienen curvas",1,Neutral,0.0
"""al final si pudiste, no moriste en el intentó y dolió menos que quedarte""",1,Negativo,-0.296
"Relájate, échale ganas a tu relación, no seas pendejo.",1,Negativo,-0.296
"Toma, esos son los numeros de la loteria el año entero",1,Neutral,0.0
Si la amás dejala ir. No le vas a ganar cáncer. Abrazala todo lo que puedas.,1,Negativo,-0.296
"No es Laura, es paco, no lo hagas",1,Negativo,-0.5267
Vende tu bitcoin cuando supere los 100k,1,Neutral,0.0
No entres a twiter,1,Negativo,-0.296
No perdones una infidelidad,1,Negativo,-0.296
"No perdones una infidelidad, loa infieles no suelen cambiar",1,Negativo,-0.5267
"Gracias por resistir, gracias por aprender, gracias por no caer en la tentación, hiciste lo que tenías que hacer y hoy doy gracias por tu fuerza",1,Negativo,-0.296
"No te vayas por el dinero facil, esta embrujado y lleno de pesadillas!",1,Negativo,-0.3595
Tienes 3 años de dolor adelante,1,Neutral,0.0
SUBNORMAL!!!!!,1,Neutral,0.0
Vive sin importa que. Suena simple. Pero maldito sistema que nos moldea para ser infelices. Malparido Rockefeller,1,Negativo,-0.5574
"Te va a caer plata como nunca has visto en tu vida.
Sigue enfocado , no te rindas",1,Negativo,-0.296
Come bien cabron,1,Neutral,0.0
"Lo pasaras mal, pero haz lo mismo que has hecho ahora. Habrás descubierto muchas cosas sobre tí, y son muy importantes. Sigue así, ahora como estás has mejorado mucho. Podrás superar lo que te está pasando solo da el paso como hice yo",1,Neutral,0.0
No renuncies a tu trabajo!,1,Negativo,-0.3595
Ahorra 10 al dia,1,Neutral,0.0
No vendas ese lancer...,1,Negativo,-0.296
Estudia,1,Neutral,0.0
"Huye de casa, antes de que tus padres se divorcien.",1,Neutral,0.0
"Que tu padre se haga exámenes y aprovéchalo harto. Si no, va a terminar igual que tu mamá. 🪦💀",1,Negativo,-0.296
Valora a mamá,1,Neutral,0.0
Estás más pendeja ahora que en tres años más,1,Neutral,0.0
Invierte en el semen,1,Neutral,0.0
Compra BTC.,1,Neutral,0.0
"Vas bien. Lo estás haciendo muy bien. Vas a llevar coñazos, te vas a caer, te vas a lastimar pero saldrás de toro y aprenderás, ni te imaginas las cosas que aprenderas, y hoy día, no te sientes tan bien, pero porque sigues aprendiendo, y lo lograrás, no se que vas a lograr pero lo lograrás.",1,Negativo,-0.5267
No hagas ningún trato con sicilianos a menos que tengas como pagarles si es que quieres conservar tus piernas,1,Negativo,-0.296
No te aferres a lasos sanguíneos nadie te ayudará tanto como tu misma a salir de los momentos malos. Familia no es gente.,1,Negativo,-0.5267
Deja de ver series están cada día peores.,1,Neutral,0.0
mogolico del orto,1,Neutral,0.0
No leas cómics de furros,1,Negativo,-0.296
Corre!!!!,1,Neutral,0.0
Mano.... no puede ser... seguís en las mismas... que triste...,1,Negativo,-0.296
"no te enamores ,estupido",1,Negativo,-0.296
Invierte para derrotar la inflación,1,Neutral,0.0
"No era necesario matarlo,en 3 años si lo haces tendrás un juicio de asesinato",1,Negativo,-0.296
"Hazte una Pyme, no hay empleo",1,Negativo,-0.296
Estas como una cabra,1,Neutral,0.0
Todo edta bien no te preocupes por el mañana vive el momento,1,Negativo,-0.296
Fucking métete al gym flaco de mierda.,1,Neutral,0.0
"Blinda un poco más el corazón, pensa en vos primero.",1,Neutral,0.0
"Haz ejercicio y pasa más tiempo con tu abuela, estudia más y no te juntes con ellos.",1,Negativo,-0.296
No vayas donde las cariñosas,1,Negativo,-0.296
"Vas a lograr mucho, esa persona con la que ahora estás, si es, pero no estás listo, y está otra persona, mejor ni la registres. Seguí enfocado en vos y tus metas, creeme que se nos va a dar",1,Negativo,-0.296
"Las decisiones que estas tomando tendrán un peso enorme , se que estas cansado , se que sientes que estas perdiendo mas de lo que estas ganando pero te prometo que estarás bien. y alguien sabrá amarte de la manera que siempre quisiste.",1,Neutral,0.0
Estas bien bonis,1,Neutral,0.0
Mama bicho,1,Neutral,0.0
"Se fuerte mentalmente, no caigas, no vuelvas a tomar licor... desearía volver atrás y no haber vuelto a tomar!!!...",1,Negativo,-0.7562
"Aposta todo lo q puedas, aca t dejo resultados
Champions 2023 la gana el city
2024 el Real
el Barça le gana la supercopa al madrid en 2025
boca pierde una final d libertadores 
Central Campeon 2023
sabes cómo me hago millonario",1,Positivo,0.6808
Ahorita te sientes así pero yo vengo a decirte que la estás rompiendo 🔥🔥🔥 levántate y sal a ganar el partido 🙌🏻🔥,1,Neutral,0.0
tu mejor amigo es femboy... tené cuidadito.,1,Neutral,0.0
"Enfocate, no arriesgues las cosas, trabaja.",1,Negativo,-0.296
"Estudia la carrera que te gusta, no caigas en la presión de tu madre 🥲",1,Negativo,-0.296
"enojate menos, tene mas paciencia.",1,Neutral,0.0
Confia mano,1,Neutral,0.0
"usa forro, que estan caros los pañales y deja a esa loca wachin que no es lo mejor para tu futuro/proyectos!",1,Negativo,-0.3595
Hace terapia,1,Neutral,0.0
Mañana será bonito 🌟,1,Neutral,0.0
Vete de Venezuela 😭,1,Neutral,0.0
Déjalaaaaaaaaaaa no vale la pena,1,Negativo,-0.296
"Vamos a llegar a buenos aires, tu sigue ahorrando, no te descuides y por favor acaba esa carrera a distancia.",1,Positivo,0.128
"No te voy a mentir, te estás metiendo en uno de los peores trabajos que vas a tener... Pero aún así, lo vas a disfrutar mucho. No te lo tomes tan en serio, relajate y disfruta del camino, que vas a aprender un montón de cosas.

En cuanto a la uni... La verdad es que me la re contra saltee, pero te diría que intentes ir a una cerca, más que nada por la paja del viaje.

El resto, depende de qué no cierres tu corazón y aprendas a expresarte mejor con tus seres queridos. Mucha suerte hermano, que la fuerza esté con vos y que dios te recoja en su santa gloria.",1,Negativo,-0.6808
Te vas a dar cuenta que fueron 4 años enamorado al pedo,1,Neutral,0.0
te comento q todo sigue igual....,1,Neutral,0.0
hace dieta y compra dolares,1,Neutral,0.0
Everything is gonna be alright 😌,1,Positivo,0.25
"Espabila de una vez y aprende a querer más y mejor a quien valga la pena, boba",1,Neutral,0.0
Si piensas que todo ha Sido malo. Ahora viene lo peor,1,Positivo,0.34
"No inviertas en proyectos de Rankenus, a esos pendejos les pasa de todo.
No inviertas en Yo te presto, esos animales que piden prestado no pagan.",1,Negativo,-0.6808
"Todo va a salir bien, confia en el camino. Me recuerda a la canción “vienna waits for you”",1,Neutral,0.0
"1. Pendejo
#
2. La universidad no esta tan fea
#
3. Pendejo
#
3. Tomate las pastillas
#
3 . Aprende a contar",1,Negativo,-0.296
La gente es bien mierda! Pero es algo que ya sabes solo te lo confirmó!,1,Neutral,0.0
No salgas del país!,1,Negativo,-0.3595
"Estudia más, las lagunas no se reponen jamás. Y abraza más a tu papá.",1,Negativo,-0.296
"No eres realmente estúpido, solo eres flojo, Muy flojo. No creas que te digo esto para tirarte al piso, lo hago por qué te quiero, quiero que seas fuerte por qué ese es tu destino.",1,Negativo,-0.296
No te cases,1,Negativo,-0.296
No comas eso!!!,1,Negativo,-0.4724
Porfavor alejate de esas mujeres,1,Neutral,0.0
No te metas a estudiar en la UTA,1,Negativo,-0.296
Estudia weon así tus padres no te pagarán la uni privada porque no te Hagarraron en la pública no por pendejo si no por pelotudo…!,1,Negativo,-0.7959
Métete para estudiar dentista.,1,Neutral,0.0
Compra btc,1,Neutral,0.0
Tss endejoooo,1,Neutral,0.0
"Aunque ahora la vida pese demasiado y sientas que te has perdido al grado de creer que continuar siguiendo tus ideales no vale la pena, te aseguro que lo vale. El cómo eres habla de ti, no el cómo actúa el resto ante ti. Puedes superar fácilmente que alguien no sea buena persona contigo, pero jamás superarás sentir que tú ya no eres una persona excepcional si haces mal.",1,Negativo,-0.7783
Estúpido,1,Neutral,0.0
"No seas huevón y ponte a matricular en más cursos electivos para levantar el promedio también busca trabajo para tus prácticas, c0judo de mrd",1,Negativo,-0.296
"Perdón,",1,Neutral,0.0
No la kgues,1,Negativo,-0.296
compra Stonks de Nvidia,1,Neutral,0.0
La vida es riesgo Miclo. Vatos locos 4 siempre,1,Neutral,0.0
Wbn,1,Neutral,0.0
"""No te encariñes rápido, por más que te cueste, NO LO HAGAS CON NADIE""
""Tu vida a partir del 2023 va a ser una mrd""

Perdón si paresco re depresivo JAJAJA",1,Negativo,-0.6289
ten amiguitas mejor,1,Neutral,0.0
Insiste más en el año sabático,1,Neutral,0.0
Mira bro van a revivir un lobo en 3 años bro loquisimo bro,1,Neutral,0.0
Provecho con nuestra prima 😋😋😋,1,Neutral,0.0
"Porfavor, hazte exámenes de sangre, haz más ejercicio, come mejor, no te encadenes mucho emocionalmente con nadie.",1,Negativo,-0.296
Compra cryptos estables,1,Neutral,0.0
"No te metas en deudas innecesariamente, no la embarres",1,Negativo,-0.5267
Todo igual?🤔...sep...todo igual 🤷,1,Neutral,0.0
sigue! tú puedes con todo reina!,1,Neutral,0.0
"justamente estaba recordando ese año por lo mal que me sentía y que actualmente me siento igual, y que me aparezca este post es algo loco porque solamente le diría que todo estará bien, que lo luego conocerá personas que la ayudarán a amarse más y no querer tomar esas decisiones. Debería ser todo lo que me diga ahora mismo por como me he sentido estos meses, pero siento que estoy en punto de quiebre donde puedo leer o escuchar eso y aún así no causan diferencia en mi...",1,Negativo,-0.5267
Abraza más a tus abuelas ❤️‍🩹,1,Neutral,0.0
"Hiciste bien en dejar a Voldemort (mi ex) para poder estar con las dos personas que más te aman.
No es sencillo llegar a los 26 Pero por favor seguí adelante pequeña",1,Positivo,0.128
"Sepárate, no pierdas el tiempo y disfruta más, no te cierres en una relación sin darte la oportunidad de enamorarte. No dudes más y te arrepientas luego.",1,Negativo,-0.8481
"Ahorra en dólares,  saca tu visa y vete sin pensarlo tanto",1,Negativo,-0.5574
En tres años más te hablo.,1,Neutral,0.0
"No estudies en una universidad abierta, no vas a aprender nada.   
No estudies programación, al menos a mi no me ha ido bien.   
Ve quitandote la pena de vender o cualquier cosa que te exponga a socializar más y haz un negocio con eso, mejor que creer que programar te va a sacar de pobre.",1,Negativo,-0.6597
"La vida se va a tornar interesante y a veces pensarás que es difícil por aquellos momentos de estrés que vas a pasar. No te preocupes, tú puedes
Y recuerda siempre estar con tu familia, que ellos siempre te van a apoyar.
Sobre todo date tiempo para ti y dedícate a lo que te hace feliz.
No te rindas",1,Negativo,-0.5267
"Protege tu salud mental, en 3 años estaras en la ruina, amigo...",1,Neutral,0.0
Comprá dolares,1,Neutral,0.0
"Cuídate, no te reprimas sigue siendo tú las personas van y vienen, las amigas y personas correctas llegarán",1,Negativo,-0.296
"La estás cagando, abre los ojos, escúchate a ti misma no a los demás… no seas pendeja….",1,Negativo,-0.5267
"Un hombre fue lo suficientemente paciente contigo como para quererte a pesar de ser una ramera analfabeta.
Y tu mamá dejó de maltratarte",1,Neutral,0.0
"Busca este topic de reddit, cada tres años, hasta 1989, sáltate Dougie Houser, Vicki Small Wonder y The Wizard de Nintendo, no pidas regalos de navidad y comienza a estudiar tres ivy carreras desde ya y corre wn, corre!",1,Negativo,-0.3595
"Comparte lo que sientes, no está mal admitir que no estas bien, te ahorraras problemas después y mejorarás como persona, da esos detalles que tanto pensaste dar",1,Negativo,-0.5267
Mátate,1,Neutral,0.0
"No tengas novio, estás muy pequeña, hazme caso y estaremos mejor después, seremos más felices.",1,Negativo,-0.296
Mándale mecha,1,Neutral,0.0
Imbecil,1,Neutral,0.0
las de menos de 1500 son ex-men,1,Neutral,0.0
Dale a todas!!! A todas!!!!,1,Neutral,0.0
Chiga tu madre porfa 🙏,1,Neutral,0.0
no vale la pena sufrir por los errores de los demás,1,Negativo,-0.296
"Deja de ser débil, no dejes que los otros te usen",1,Negativo,-0.296
Pendeja no te enamores de aquel pendejo que solo te utilizara para saber que quiere 🤦🏻‍♀️ y no por que te ama,1,Negativo,-0.5267
"Despierta del trance cabrón, la vida vuela.",1,Neutral,0.0
"Absolutamente nada, todo lo que he hecho en estos 3 años me ha ayudado a mejorar como persona, y sin estas experiencias seria uns mierda, puede que un poco más atras si me advertiria de cosas las cuales nada más me han herido, pero estoy bastante orgullosa de mi avance y proceso como persona a pesar de cometer muchas cagadas en estos años.",1,Negativo,-0.296
Estas bien pendeja!!!!,1,Neutral,0.0
"""juega al roblox""",1,Neutral,0.0
"No te metas a ingeniería química por la química, mejor métete a QFB",1,Negativo,-0.296
"No metas maestros barcos, sobre todo en Control de Máquinas y PLC.",1,Negativo,-0.296
"Las personas que consideras tus amigos, no lo si realmente",1,Negativo,-0.296
Si te pusiste mas guapa y si te volviste mega social. Besos en la pucha hermosa,1,Neutral,0.0
PENDEJO,1,Neutral,0.0
"Apuestale a que Messi gana el mundial y la copa america, al igual que el bicampeonato de los Chiefs",1,Neutral,0.0
"""apaga el pc webon, ya amanecio y sigues ahi""",1,Neutral,0.0
METELE TODO AL ROJO,1,Neutral,0.0
VAS A PODER. SEGUI INTENTANDO. NO TE RINDAS. SALIÓ COMO QUERÍAS.,1,Negativo,-0.296
"se que lo que viene será lo peor que vivirás en tu vida, pero créeme que al final estarás tranquilo. Confía en la luz al final del tunel",1,Neutral,0.0
"Hubieras saltado de ese edificio de 10 pisos,",1,Neutral,0.0
No te encarames a buscar la tostadora te vas a caer,1,Negativo,-0.296
No prestes esa plata que no te la van a devolver.,1,Negativo,-0.5267
Haz deporte,1,Neutral,0.0
Ya pasaron 3 años :),1,Positivo,0.4588
Todos los números de la lotería de cada día de esos 3 años! Jeje,1,Neutral,0.0
Que seguimos igual de jodidos 😂😎,1,Neutral,0.0
"Sigue por dónde vas, así vas bien.",1,Neutral,0.0
Sacala a tiempo,1,Neutral,0.0
No te cases con esa perra!,1,Negativo,-0.3595
Se va a poner peor,1,Neutral,0.0
No salgas con la de Tabasco,1,Negativo,-0.296
"No se, no es que haya habido buenas oportunidades, solo le diría que haga algo que realmente disfrute, no es necesario seguir haciendo cosas que odias.
También que se tomé el inglés más en serio, idependientemente de la chamba, ayudará para el aprendizaje, y que sea más mamón, las personas a veces solo entienden a las malas.",1,Negativo,-0.6808
Que entrene y se haga respetar.,1,Neutral,0.0
No te metas a estudiar programación no seas pendejo,1,Negativo,-0.5267
No seas rencoroso ni brutalmente honesto,1,Negativo,-0.296
Cada maldita decisión que tomaste te lleva a mí,1,Neutral,0.0
Eres un pendejo,1,Neutral,0.0
Aprende a dividir,1,Neutral,0.0
"Deja de perder tu tiempo con personas pendejas, estudia y ahorra",1,Neutral,0.0
"cagalo a puteadas y a piñas, no te olvides la libreta y escribele elige estudiar Profesorado de Inglés",1,Negativo,-0.296
Pendejo,1,Neutral,0.0
"Estoy decepcionado de vos, pero en un futuro vas a ser grande y mejor ❤️‍🩹",1,Neutral,0.0
"pelotudo de mrd, madura y deja de decir boludeces, no sabes ni un carajo de la vida. Y eligí bien con quien te juntarás estupido de mrd que ahora te llevas mal con medio mundo",1,Negativo,-0.296
Enano,1,Neutral,0.0
Aléjate de la mujeres...!!!!,1,Neutral,0.0
"Seguis en el mismo lugar, no te cagues y toma otro camino, pelotudo",1,Negativo,-0.296
Contratale a tus padres un seguro de gastos médicos mayores no seas estupido,1,Negativo,-0.296
"Pendejo, no vale la pena esa persona, estarías mejor con la madre de tu hija o quizás era lo que necesitabas tu para aprender y cambiar tu actitud.

Cuidala mucho y sabes bien que pese a todo, ustedes 2 siempre son un soporte para la niña, enserio no quiero que te arrepientas cuando ella ya no esté en este mundo o estés en ese instante para salvarla como yo no pude hacerlo.",1,Negativo,-0.7783
Salta,1,Neutral,0.0
Porque no la dejaste ir idiota!!!,1,Negativo,-0.4724
Ahorra pendejo ahorraaaaa,1,Neutral,0.0
"Quédate allá no seas wey, de todas formas la vas a terminar",1,Negativo,-0.296
Chingas a tu madre,1,Neutral,0.0
No te vayas de tu país. No creas que es posible salir de tu destino. No pienses que eres importante,1,Negativo,-0.6808
No confíes en las personas falsas.,1,Negativo,-0.296
Disfruta y no le tengas miedo al rechazo (aunque suene básico y re buscado),1,Negativo,-0.296
"Invierte todo el dinero que puedas.   
El mercado laboral se puso de la verguisima.   
Compra todo el bitcoin que puedas en diciembre.  
Shortealo  en enero 2025 po debajo de 108k y cierra en 77k.",1,Negativo,-0.5574
"La economia se va a ir a la mierda, ahorra tu dinero.",1,Neutral,0.0
"No confíes en nadie...
Por favor imbécil",1,Positivo,0.128
Le diría que pueda aprovechar de mejor manera su último año  y que no la cage en el viaje de promoción,1,Negativo,-0.296
Pasa todo el tiempo que puedas con tu mamá,1,Neutral,0.0
Hazlo! igual te vas a M0r¡R algún día.,1,Neutral,0.0
"Corta con la tóxica ya. Antes que te engañe la muy infiel. (Enserio lo hizo, y antes de eso se puso a decir que como no me corría al instante en ella no la quería. y con eso se justificó) Era fea como un goblin pero era mi goblin. (Goblin de goblin slayer.) Y aún así me traicionó.",1,Negativo,-0.5267
"Sabía que lo ibas a lograr, confíe en ti.",1,Neutral,0.0
Ve más seguido a la playa,1,Neutral,0.0
"No te enfoques en las amistades o tener pareja, amate y quiérete, eres más que suficiente.",1,Negativo,-0.296
"No dejes de crear contenido. Así estés en la mas high zona de confort. Sigue abriendo tu camino... porque ese confort en el que estás, se acabará de golpe.",1,Negativo,-0.296
El pasado me guia,1,Neutral,0.0
"No dejes esa colonoscopia para despues. Afortunadamente no habia progresado a nada, pero Dios que buen susto me saque.",1,Negativo,-0.5267
"El único amor y validación que necesitas es la propia, no te rebajes por alguien que te trata como desechable",1,Positivo,0.4215
"Sigue intentado, solo sigue. No importa si sientes que fallas, no pierdas la esperanza, sigue intentando una y otra vez, no lo sueltes, y vuelve a intentarlo. Pero recuerda que este consejo no sirve para nada en el amor",1,Negativo,-0.4215
"Chico, deja ir a quien tengas que dejar ir, amate y valora a las personas que están contigo, no a las que te han abandonado, de nada te sirve alguien a quien no le importas. Abraza más a mamá, deja de lado todo el dolor y arregla tus errores en vez de lloriquear.... Deja de ver anime XDD",1,Negativo,-0.5267
"Eres fuerte y has logrado mucho, tu siempre puedes",1,Neutral,0.0
Hay que ser una persona perseverante porqué el que persevera triunfa,1,Neutral,0.0
"Estoy orgulloso de vos.

Creo que seria la primera y ultima vez que escucharia esas palabras xd",1,Positivo,0.5859
"Te recuerdo mucho menos preocupado que hoy. Este mundo cada día está peor, más odioso y corrupto.",1,Neutral,0.0
"No debiste haber fallado en tu suicidio, no ha pasado nada bueno de todas maneras",1,Negativo,-0.25
"No te dejes llevar por una ruptura, te va a costar el entrar a la uni a estudiar la carrera que siempre has querido 😢",1,Negativo,-0.296
Compra vivienda,1,Neutral,0.0
"Estudia vago de mier... Si se puede todo está en tu mente, Pero hazlo ya!!!",1,Neutral,0.0
No le apuestes al rojo,1,Negativo,-0.296
Compra la caja (venia una carta de 10000 pesos mexicanos jejej),1,Neutral,0.0
Se va a poner incluso peor la cosa. Aguanta.,1,Neutral,0.0
No vuelvas con tu ex?),1,Negativo,-0.296
"""Todavía no estarás viviendo ahí pero todo va a ir bien, mejor de lo que te puedes imaginar ahora mismo. Pero a ver si tienes más huevos para hablarle a las chicas que te gustan""

  
\-Ahora lo haces ya?

  
""estamos hablando de ti, no mezcles""",1,Negativo,-0.5267
Querido yo de hace 3 años: no tengo IDEA de cómo ser un adulto,1,Negativo,-0.296
"Primero me daría una bofetada o un combo porque daba mucho cringe no en mi forma de actuar solo que era muy pollito y me diría déjate de dar pena, enfócate en los estudios, en mejorar como persona y dar siempre lo mejor de ti yo confío en que puedes",1,Negativo,-0.296
estas en el mismo lugar de siempre que pasa que no avanzas???,1,Negativo,-0.4098
No busques pomedari en Youtube,1,Negativo,-0.296
"Saca carnet de conducir. Si, se que odias manejar, pero necesitas hacerlo",1,Neutral,0.0
"""No pruebes ese cristal, la peda se te bajará por si sola, ve a casa, mamá te espera, mañana tienes clases.
Te quiero tanto, te quiero cómo nunca te pudiste querer cabron, por eso debo cuidarte.""🫂",1,Negativo,-0.296
