Comentario,Upvotes,Sentimiento,Puntaje Sentimiento
"Boff... Lo más sencillo sería decirle de ponerle con el gym un poco antes y relajado y así joya.


También podría buscar las fechas y horas de algún shit pin rugpull pa hacerme rico (o número de lotería... O almanaque deportivo...)",1,Negativo,-0.5574
"Niño, vas a flipar.",1,Neutral,0.0
"Alejate de ella, no esperes a que ella lo haga",1,Negativo,-0.296
"""Tranqui. Vas a estar bien""",1,Neutral,0.0
Tienes ya lo q necesitabas en unos años solo no debes desmotivarte,1,Negativo,-0.296
Felicidades por tu perseverancia has llegado muy lejos sientete orgullosa de que lograste en el futuro te esta siendo compensado.,1,Neutral,0.0
hola,1,Neutral,0.0
Encuentra otra forma de desahogarte que no sea el chupe,1,Negativo,-0.296
Las cosas van a empeorar jajaja,1,Neutral,0.0
"Si crees que va a mejorar, ¡no lo hará! Que te jodan.",1,Neutral,0.0
Juan deja la paja.,1,Neutral,0.0
Quiero volver hace tres años y decirle cómo me encuentro ahora...,1,Neutral,0.0
Llenate todo lo posible de bitcoin y cuando llegue a 95k vende.,1,Neutral,0.0
Coje el avión e no mires patras...,1,Negativo,-0.296
"Mira reverendo imbécil, ponte a estudiar deja de hacer el idiota",1,Neutral,0.0
"Aléjate de esa loca, te va a terminar después de 2 años, se va a meter con su ""Mejor Amigo"" y la van a botar al mes, luego te va a estar acosando y saliendo te hasta en la Sopa....",1,Neutral,0.0
"Gracias por aprender cosas nuevas , siempre debes tener nuevas experiencias. Para que cuando seas abuelo cuentas grandes historias a tus nietos.",1,Neutral,0.0
Compra acciones NVIDIA,1,Neutral,0.0
"deja de perdonar a ese desgraciado, nunca te quiso en un primer lugar",1,Neutral,0.0
Pendejo,1,Neutral,0.0
"Das asco de ver y no te haces el boludo, sos uno",1,Negativo,-0.296
"Deja tu tristeza y hazte fuerte, no hay lugar para los débiles.",1,Negativo,-0.296
Hola,1,Neutral,0.0
Comprá bitcoins. (Válido para cualquier año desde que se creó bitcoins),1,Neutral,0.0
"Todo esta mejor y lograrás ser feliz, tente paciencia y sobre todo amor",1,Positivo,0.6124
Aún estás a tiempo si la convivencia no funciona no te lastimes mas,1,Negativo,-0.5267
"Levante todo y vaya, que sos más picante en soledad",1,Neutral,0.0
Pendejo,1,Neutral,0.0
"Confía en ti, eres tu propio respaldo",1,Neutral,0.0
"Hecha a tu amigo de la pega, fue un error",1,Negativo,-0.4019
"Todo va a estar bien, lograrás superar tu depresión y harás que todo duela menos.",1,Neutral,0.0
pasar más tiempo con mi  hermano y hablarnos y dejar de estar peleados se murió y así quedamos años sin hablarnos me arrepiento muchísimo lo extraño.,1,Negativo,-0.5574
No te cojas a ese gato,1,Negativo,-0.296
Mete el 100% de tus ahorros en Nvidia y vendelo todo la primera semana de noviembre del 2024,1,Neutral,0.0
Puñetes sal de ahi,1,Neutral,0.0
Se amable con ella no le digas nada intenta ser su amiga no la espantes y cuando la conozcas nunca le digas eso que piensas.,1,Negativo,-0.5267
Yo le pegaría una madriza,1,Neutral,0.0
A donde vas seguirás aprendiendo...,1,Neutral,0.0
"Nena vos seguiras siendo bonita y adorable, solo estudia mas y no te preocupes que papa siempre estara bien",1,Positivo,0.25
Ponte a hacer ejercicios y consíguete esa muchacha de octavo que es más bonita que todas las otras en la escuela y deja de tener miedo escénico,1,Neutral,0.0
no vayas a esos 15s y te pongas de novia con ese pelotudo q te arruino todo,1,Negativo,-0.296
Como estas wey (pero tqm),1,Neutral,0.0
Idiota,1,Neutral,0.0
No gastes tu tiempo. No te divorcies. Disfruta lo mucho mucho que tenes.,1,Negativo,-0.5267
Compra criptos weee,1,Neutral,0.0
COMPRA BITCOIN HDP,1,Neutral,0.0
"Recuerda q no siempre tienes q ser el que tiene que aceptar y comprender todo, también tienes derecho a enojarte",1,Negativo,-0.296
"Valiste verga, te cerraron la universidad, no te preocupes por otras estupideces. Y has ejercicio",1,Negativo,-0.296
que no debi dejar que cualquiera  me ame,1,Negativo,-0.296
"La vida es dura, pero más dura tu verdura 🍆",1,Neutral,0.0
Folla mientras puedas,1,Neutral,0.0
Baboso.,1,Neutral,0.0
"Entrena pesado y al fallo y sal de ahí, mereces más",1,Neutral,0.0
"""No te cuesta nada preguntarle a la maestra por Whatsapp.""",1,Negativo,-0.296
Todo va a mejorar!,1,Neutral,0.0
idiota,1,Neutral,0.0
"""no seas caprichosa con el""",1,Negativo,-0.296
Chupapi muñaño.,1,Neutral,0.0
"Yo de 16: adivina, conseguí novia

                                                                                                     Yo de 13:jodeme¿Y que vas soñaste?",0,Neutral,0.0
Todo.. tiene un aprendizaje para bien o para mal,10,Neutral,0.0
Y además me daría una cachetada al estilo doña Florinda..,1,Neutral,0.0
X2,1,Neutral,0.0
Lo mismo pense!,1,Neutral,0.0
Creo que basto una palabra tan sencilla para describir 😂😂,1,Neutral,0.0
"Pues si, pendejo",1,Neutral,0.0
Brutal,10,Negativo,-0.6249
¿Que?,8,Neutral,0.0
"Esta bien tener secretos, sabes?",5,Neutral,0.0
Khé?,2,Neutral,0.0
Te ganaron los pensamientos intrusivos 🤣,2,Neutral,0.0
Ora,1,Neutral,0.0
JAJJAJA LA GENTE,1,Neutral,0.0
Jajaja no te da bola,3,Negativo,-0.296
X2,2,Neutral,0.0
"Te lo decían tus padres, sabías que tenían razón y aún así no ll hiciste, por qué crees que te ibas a hacer caso al tu del futuro?.
(Por lo menos en mi caso creo que haría eso que dije).",2,Negativo,-0.296
Uf hermano. Hijo de puta. Estaba teniendo un buen día.,14,Neutral,0.0
Me desbloqueaste un Trauma que creía tenía bien gestionado. (Justo en el Trabajo),6,Negativo,-0.4215
🥺🥺🥺 momentos tristes... Que Jamás  se olvidarán,4,Neutral,0.0
Somos dos,5,Neutral,0.0
Joder…,3,Neutral,0.0
Auch... El mío murió hace muy poco.,1,Neutral,0.0
En la misma. Ahora se echa de menos. Cuando pensaba que tenía más tiempo.,1,Neutral,0.0
"Siempre intento compartir mucho tiempo con mi familia like sin importar cuánta tarea tenía ni que tan pesada estuviera o este la chamba siempre trato, pero al final se que nunca será suficiente",1,Negativo,-0.2732
Importante esto.,8,Neutral,0.0
Deja el lol,3,Positivo,0.4215
Ten mas tiempo de calidad paratus hijos y mas amor porque no les van A durar todá la vida,1,Positivo,0.4215
"Ay dios, la primera parte me hizo replantearme el mensaje",4,Neutral,0.0
"No lo hagas por ninguna mujer, hazlo por ti, aún estás a tiempo, cada día es una nueva oportunidad para volver a empezar.",1,Negativo,-0.296
"Si una mujer te ama a pesar de ser mediocre, ¿vale la pena?

Le he dicho a mi mujer: “Si me ves siendo menos de lo que debería ser, motívame. Si no te hago caso, déjame. Mereces más”.",1,Neutral,0.0
"Malo, pero adictivo... 🥴",5,Neutral,0.0
",👏👏👏👏",1,Neutral,0.0
"Yo le diría a mi yo del pasado que mejor no estudie programación, pero no es porque sea mala la programación, solo no me ha ido bien ni un solo día. Nunca conseguí trabajo, y ahora que inicié mi emprendimiento en algo mucho más sencillo, haciendo páginas web (yo hago backend realmente), no he conseguido ni una sola respuesta de todos los prospectos que he contactado ni de toda la publicidad que he hecho. 

Lo de no pensar en parejas está muy buen. Eso se busca cuando ya estás bien (que en mi caso no sé cuándo será xD)",1,Negativo,-0.765
"Literalmente.

Compra, se va a hacer aun más rentable pero sin calentarte.",3,Negativo,-0.5574
"Yo quiero aprender a comprar o ese rollo en general , me enseñan",1,Neutral,0.0
Recuerdo cuando valía 10 dólares recién por ahí aproximadamente 🤧,1,Neutral,0.0
No we eso era desde el 2012 necesitas 10 años más atrás para aplicar 🫠,1,Negativo,-0.296
Recuerda !!! Que no todo es para siempre,1,Negativo,-0.4724
Carajo este si me pegó recio,1,Neutral,0.0
"Le diria que corte vinculo con todo el mundo.
hoy 2025 estas en la ruina por poner a los demas por sobre ti y todo se fue al demonio.",1,Neutral,0.0
Esto es tan tan cierto,1,Neutral,0.0
"Se oye que hay una historia interesante detrás, que paso?",1,Neutral,0.0
Storytime si no te molesta 😔,1,Negativo,-0.296
Re abusivo con su yo del pasado jajaja,2,Neutral,0.0
Cuando el amor termina el hambre sale por la puerta,2,Positivo,0.6124
Yo ese xdddd,1,Neutral,0.0
"Por eso siempre pregunto algunas veces quedó como pendejo otras follo para mí es un precio justo 
""Me estás tirando la onda?""",1,Neutral,0.0
Jajajaja X2,1,Neutral,0.0
🤣🤣🤣x2,2,Neutral,0.0
"X2
""Ahora que no está tan jodido puedes irte feliz""",1,Negativo,-0.296
Desgraciadamente buen consejo,2,Neutral,0.0
No siempre los cambios son tan buenos ... Pero todo te deja un aprendizaje,1,Negativo,-0.296
yo esa,1,Neutral,0.0
Todo pasa !!!  Nada es para siempre,1,Neutral,0.0
Ufff desde la maestría,1,Neutral,0.0
Jajaja pero ni es tan largo ese juego como para acaparar años de vida,1,Neutral,0.0
O también: me tienes harto hijo de la verga siempre lo mismo contigo de lol de que fortnite ya wey cállate espantas a las viejas,1,Positivo,0.4215
y la que te gusta te va a rachazar,1,Neutral,0.0
Junto a: aprovecha cada bendito minuto junto a  tu padre,1,Neutral,0.0
Jajaja x2,1,Neutral,0.0
Recuerda que todo es efímero.,3,Neutral,0.0
"Le diría ""aunque te dé miedo hablarle sueña con que la beses. Hablale tranki.y se te va a dar. Es por ahí"". (Válido para decirle también a mi yo de hace tres meses, tres días y tres horas)",1,Neutral,0.0
"No sé, tal vez me vecomo vagabundo y le echa ganas",1,Negativo,-0.296
Son locas en la cama y siempre tienen ganas😂,6,Neutral,0.0
"Yo normalmente aprenderia a programar porque me gusta, no solo por trabajo, sin embargo entiendo tu punto",1,Negativo,-0.7003
"Te recomiendo ver videos, pero no puedo darte uno específico, hay muchos que te explican cómo funciona la dinámica. Y, no confíes en los vídeos que te recomiendan X criptomoneda (o sea, que te digan una en específico para que compres).

Y, compra suave (es decir, no gastes demasiado), es una manera de aprender y al mismo tiempo te puedes sacar algo si ganas, y si no, revisa por qué no ganaste.

Y lo más importante, mira noticias relacionadas con las cripto, usualmente hay canales que son informativos en cuanto a eso, pero muchos en inglés.",1,Negativo,-0.7184
"Más bien es cuando el dinero falta el amor sale por la puerta, no?",3,Positivo,0.4215
Si sobretodo que ahora estoy cesante y no encuentro trabajo #aiuda #halp jaja,1,Negativo,-0.296
Y un segundo bien usado se convierte en eterno,1,Neutral,0.0
Oiga. UD si que sabe,1,Neutral,0.0
Lol,1,Positivo,0.4215
"Cuando la pobreza entra por la puerta, el amor salta por la ventana 🪟",1,Positivo,0.6124
