Comentario,Upvotes,Sentimiento,Puntaje Sentimiento
"Estudia, y no veas nopor de femboys todo el día (okno)



En realidad, sería esto: Se que la pandemia te jodió la adolescencia, haciendo que te sientas más solo de lo normal, pero aprovecha que tienes internet para aprender nuevas cosas y también para desarrollar habilidades y conocer gente. 
No dejes que los malos pensamientos y las dudas saboteen tu autoestima, a la larga esto te perjudicará mucho. Trata de descansar, de beber agua, de hacer ejercicio, de comer sano y de mantener el entusiasmo por la vida.

Y no te enamores de e-girls, dejan evento canónico (afortunadamente no entable relación con una).",1,Negativo,-0.7783
"Tu vida mejorará, no todo lo malo es para siempre, una día saldrás de ese hoyo en el que estabas",1,Negativo,-0.296
Mátate.,1,Neutral,0.0
"Estudia wey, te metiste en 8 extraordinarios",1,Neutral,0.0
Todo va a mejorar no te rindas y aprende de tus errores.,1,Negativo,-0.296
Deja la paja,1,Neutral,0.0
"Esta bien si te equivocas, es parte del aprendizaje de la vida, ¡ánimo!",1,Neutral,0.0
No te destruyas no pruebes las drogas 😕,1,Negativo,-0.5267
Lo logramos,1,Neutral,0.0
No compres el Sonic Origins plus 🫩🥴🥴,1,Negativo,-0.296
Diviértete,1,Neutral,0.0
NO,1,Negativo,-0.296
Borra Reddit,1,Neutral,0.0
Será difícil,1,Neutral,0.0
Kys,1,Neutral,0.0
"No dudes tanto, y no temas al fracaso. 
No seas tan ""bueno"", aveces un poco de malicia es necesaria para poder conseguir aquello que quieres. Olvidate un rato de ""hacer lo correcto"" porque al final del día a nadie le importará tanto si lo haces o no, la gente no esta tan pendiente de ti como esperarían, ni valora demasiado esos mismos códigos morales que tu si. Se un bastardo qlo que va y toma lo que quiere sí se puede.
Mientras ese algo no cause daño a otros, o a ti mismo, no sientas culpa. No eres malo. 

Y lo más importante; haz aquello que deseas. El arrepentimiento es como una puta maldición, te perseguirá por AÑOS, así que solo ve y toma lo que quieres. Por último te decepcionas al final, pero al menos lo hiciste.

Y se directo, dile a esa pendeja todo lo que piensas realmente. Le va a doler, la harás llorar, pero podrías salvarla de cometer un error que la condené por años. Y de pasó liberarte de un peso emocional que no mereces cargar. Se cabron, porque con gente así no hay otra opción.",1,Negativo,-0.9623
Compra Bitcoin y no vendas hasta diciembre de 2024.,1,Negativo,-0.296
Deja de gastar a lo pendejo y prepárate para tiempos difíciles,1,Neutral,0.0
Idiota ese estúpido no te merece!,1,Negativo,-0.3595
Toma decisiones que no lastimen a la gente y otorga el respeto que se merece la otra persona,1,Negativo,-0.296
"Distraerte más,eviataras muchos problemas mentales",1,Neutral,0.0
Por tú culpa se me olvidó dividir 😠,1,Neutral,0.0
Nunca te cases con ése gilipichis😤,1,Neutral,0.0
Le diría que disfrute lo más que pueda y que cuando cumpla 17 tenga novia,1,Neutral,0.0
Abraza y pasa tiempo con tus padres antes de que sea demasiado tarde. Las cosas que damos por sentadas son las que más extrañamos cuando nos hacen falta,1,Neutral,0.0
"Matate lol
Nah mentira le diria que estudie el naco y que no tenga sus problemas de ira",1,Positivo,0.0516
"¿Recuerdas a tu (nuestro) mejor amigo? Todos esos buenos momentos; como esas noches hablando hasta la madrugada, los viajes, las comidas, etc. Y los malos momentos como cuando le diste un gran apoyo cuando tuvo ideas suic1d@s o las veces que lo acompañaste a buscar casa porque su papá lo había hechado a la calle.

Pues te va a cortar de su vida de jalón porque prefirió a la vieja tóxica.",1,Neutral,0.0
Descarga el último buen juego de la play store 😔,1,Positivo,0.34
No trabajes tanto,1,Negativo,-0.296
Los austríacos te van a joder.,1,Neutral,0.0
"Hubieras escogido primero una buena carrera pero también hubieras dejado esa relación que ya no te sumaba, probablemente antes si pero como fue amor a distancia, no se sentía lo mismo.",1,Positivo,0.1531
Ya viste que no es tan difícil hacer las cosas a tiempo y como se debe?!,1,Negativo,-0.3595
Se mas independiente y nunca vayas a españa,1,Neutral,0.0
Es demasiado tarde...,1,Neutral,0.0
Sepárate .,1,Neutral,0.0
"No te acomodes, Dios tiene un plan del lugar que escapaste",1,Negativo,-0.296
Ahorra e invierte el doble,1,Neutral,0.0
Nunca le hables a esa perra,1,Neutral,0.0
Dejá al pelotudo ese.,1,Neutral,0.0
"Ahí no es!! 
Ya déjalo ir o te vas a lastimar más.",1,Negativo,-0.4184
Que Las Mujeres No Te Valoran Solo Amaré Tu Ve Por El Mundo Haz Tus Canciones Sal A Pasear En La Naturaleza Lo Amaras,1,Negativo,-0.296
Continua lo que empezaste... no lo sueltes..,1,Negativo,-0.296
"En el momento que juegues en el círculo de la lujuria en Dante's Inferno, bájale el volumen xd",1,Positivo,0.5859
"Deja de ser pendeja, comételo.",1,Neutral,0.0
Estudia mierda,1,Neutral,0.0
Jaja disfruta la pandemia idiota,1,Neutral,0.0
Compra todas las acciones de Nvidia que puedas!!!!,1,Neutral,0.0
Abandona a esa mujer ella ya no te ama y tú ni cuenta te has dado.,1,Negativo,-0.296
Haz las cosas a tiempo y nunca dejes que te pasen a llevar.,1,Neutral,0.0
"Argentina vs Arabia, todo tus ahorros a los Jeques",1,Neutral,0.0
"Tas todo meco pero no te awites, eso no es impedimento para lograr lo que quieres",1,Negativo,-0.5267
Prepárate mejor porque te irá demasiado bien,1,Neutral,0.0
"""¿Cuando vas a entender que no puedes confiar en nadie?""",1,Negativo,-0.296
Esa no era manzanita!!!,1,Negativo,-0.4724
"Hace mucho tiempo que estás perdido, regresa a Cristo. Él te ama, no se cansa de tus debilidades. Vuelve a Él. No hagas el mal. No mientas, no finjas, no hieras a nadie. Ama a Dios y todo estará bien.",1,Negativo,-0.8402
Salta,1,Neutral,0.0
No trates mal a ninguna mujer por mas daño que te allan hecho.........,1,Negativo,-0.296
Fingiria no verlo para no cambiar nada más bien me gustaría hablar con mí yo de hace 5 días,1,Negativo,-0.5267
No veas porno,1,Negativo,-0.296
TODO ES MENTAL,1,Neutral,0.0
"No prestes dinero bajo ninguna circunstancia, esos $18000 nunca los vas a recuperar.",1,Negativo,-0.296
Te hecharan de la universidad si no te pones las pilas,1,Negativo,-0.296
"""Plazo fijo y fondos mutuos. Y cuando Trump regrese el 2025 (sí, lo sé) invierte en su criptomoneda y retírate pronto antes que él desfalque a su propia gente haciendo lo mismo"".",1,Neutral,0.0
No cuides a esas sobrinas ingrata ya después ten van a maltratar muy feo,1,Negativo,-0.296
"Hazle la barba a los inteligentes de la clase, en el futuro verás los resultados.",1,Neutral,0.0
"no seas pendejo , enfócate en tus prioridades, cumple tus sueños a toda costa, aprende a decir que no te evitarás muchos problemas a futuro , no prestes dinero y  no hagas ninguna cosa si no piensas terminarla y si la vas hacer hazla de la mejor manera, todas las mujeres mienten todas se victimizan cuando la cagan para salirse con la suya no caigas en la manipulación, no desesperes en buscar una mujer ideal  llegará la indicada y no toda la familia es buena si debes alejarte de ellas no lo dudes evitarás decepciónes.",1,Negativo,-0.9081
Cállate pendejo,1,Neutral,0.0
Coje todo lo que puedas...,1,Neutral,0.0
"Piensa bien lo que estás haciendo ,$_&+#@@##!!¥¢£® !!!",1,Neutral,0.0
"Tranquilo lo viejo no es necesario meterte con 60 al mes, bájale",1,Negativo,-0.296
Estudia,1,Neutral,0.0
"Ahorra, comprate un terrenito, construye tu casita y haz ejercicios...",1,Neutral,0.0
"Cuidado , en tres años alguien publicará que te diga al a vos ahora pero dentro de tres años.",1,Neutral,0.0
Junta más dinero 🫰,1,Neutral,0.0
Este es tu prime no dejes que caiga porque no te podrás levantar,1,Negativo,-0.5267
"No eres el culpable de los problemas de los demás. No cargas con la responsabilidad de todo lo que pasa a tu alrededor. No eres el centro del universo, y este mismo no te debe nada. No existen señales mágicas que te digan cuándo actuar o qué hacer. El único que puede tomar las riendas de tu vida eres tú.

Tu futuro depende de ti, de tus decisiones, de tu coraje para levantarte y avanzar. No temas, incluso en medio del caos, todo puede mejorar. Atrévete a dar ese paso, respira profundo, y recuerda que seguir adelante es un acto de valentía.",1,Negativo,-0.8807
"No te gastés todo el dinero que tienes en un juego, después serás baneado sin ningúna razón!",1,Negativo,-0.7263
Sos un pendejx,1,Neutral,0.0
se viene pesaito papito sjjsjsj,1,Neutral,0.0
"We, juega ultrakill",1,Neutral,0.0
"Hola Jeremy, veo que te sientes bien, todo parecer ir con un rumbo normal hasta ahora, no te preocupa demasiado el futuro y cada día vives pensando en mejorar, se te quiero dar un consejo, vive, vive y deja vivir, disfruta de las cosas simples de la vida y aprovecha cuando puedes pues dentro de unos años solo quedarán los buenos momentos, los malos se olvidarán, te lo prometo, te van a herir y trendras que sanar pero tranquilo, es parte del proceso, cada día serás más fuerte y aprenderás a mejorar tu yo. te amo.
Adiós.",1,Negativo,-0.296
"Vuelve a ir a Terapia la necesitas, trabaja en tus inseguridades y traumas, no des por sentado las cosas buenas que tienes y menos a tu pareja.",1,Negativo,-0.6597
"No lo haga compa, ahí no es",1,Negativo,-0.5267
"Ahorra hijo de tu puta madre, ese trabajo que te caga en el que te sientes de la verga si esta bien pagado, no te salgas mejor roba 300 diarios que no seran ni notados",1,Negativo,-0.5267
Ya no sigas jugando porque te vas endeudar como no tienes ni idea y ahora no tienes ni paz ni tranquilidad 😓,1,Negativo,-0.6808
"Alejate de los que son tus ""amigos"" por tu bien",1,Neutral,0.0
"Sé que esa no es la universidad que quieres pero entra, no tiene que ser la carrera que quieres, puede ser una segunda opción ingresa por esa carrera y empieza, el tiempo apremia.",1,Negativo,-0.5267
No te enamores penjedo!,1,Negativo,-0.3595
"Jamás permitas que un trabajo te robe tu tiempo 
Has música Porfavor",1,Neutral,0.0
Deja de ser pendejo y ponte a trabajar,1,Neutral,0.0
Vas bien 👍😂,1,Neutral,0.0
No invertir en la mina,1,Negativo,-0.296
Confia en ti tu puedes,1,Neutral,0.0
"Entrega esos papeles para el Colegio del aire, no te puedo explicar lo hermoso que es ver todo desde arriba",1,Negativo,-0.296
"Alejate de ella. Hasta tu mismo te lo decías por las noches, ella no te quiere como tú, alejate, no la necesitas, alejate.",1,Negativo,-0.5267
Nada a cambiado,1,Neutral,0.0
"Lograste el sueño que anhelaste..
Sigue esforzandote",1,Neutral,0.0
"A mi edad 3 ya no cambia nada, pero si fuera unos 10/15,  me hubiera estudiado a saco, en vez de hacer el tonto con amigos de clase. Porque toda esa gente desaparece de tu vida una vez  terminas la ESO.",1,Negativo,-0.296
"Si lo vas hacer, hazlo bien para ya no volver…",1,Negativo,-0.296
No confíes en nadie,1,Negativo,-0.296
Olvídalo sal de ahí y sigue con los deportes y ejercicio. Estudiar lo sabes,1,Neutral,0.0
"Abraza a tu madre, dile que la quieres, no le escondas nada",1,Negativo,-0.296
"No la cagues y se el orgullo de tus padres, no te distraigas jugando, se diligente con lo que tienes, no desaproveches las herramientas que te dan, no seas una vergüenza para tus padres, maldito guerco malagradecido",1,Negativo,-0.7783
No tuviste que hacerte la paja benja 🥵,1,Negativo,-0.296
"Gracias por los errores,",1,Neutral,0.0
Entra al gym estúpido xd,1,Positivo,0.5859
Seguí metiéndole ganas.,1,Neutral,0.0
Compra dólares,1,Neutral,0.0
Invertí en ollas essen ! 😆,1,Neutral,0.0
Algo,1,Neutral,0.0
No te enamores de esa enana wue te domina,1,Negativo,-0.296
Estudia mrda,1,Neutral,0.0
"Trata de ser mas ""maduro"" ya que cuando crezcas vas a ver fotos o videos que te hayan hecho y vas a decir ""¿Tanto cringe daba?""",1,Neutral,0.0
Hazlo suicidate ese era el momento,1,Neutral,0.0
Vete de ahí y cuida a quien te cuido,1,Neutral,0.0
"No le creas, vete del país, van a terminar en un mes",1,Negativo,-0.296
"Mijo, esa vieja no le conviene, esa relación no va para ningún lado, no le cierre la puerta a más mujeres en su vida por ella, porque el golpe va a ser fuerte.",1,Negativo,-0.6808
"Borra Tinder y Bumble y espérate al menos uno o dos años solo, y ahorra dinero.",1,Neutral,0.0
"Tienes unos huevazos , pero todavía no lo sabes",1,Negativo,-0.296
Compra bitcoin,1,Neutral,0.0
No regales esa barrita de cereal 🥣,1,Negativo,-0.296
Primero ve q no es travesaño,1,Negativo,-0.296
Cambiate de carrera,1,Neutral,0.0
no te muevas de casa en los proximos 3 años,1,Negativo,-0.296
Pendejo,1,Neutral,0.0
"No te mudes a otra ciudad, el tipo te traicionará, perderás la inversión y la dignidad xd",1,Positivo,0.3818
Esa relación ya está muerta.,1,Neutral,0.0
Sigue priorizando tu salud física y emocional,1,Neutral,0.0
"No te malgastes, es una forra. Aunque quieras terminarle bien, va a terminar mal.",1,Negativo,-0.296
Te acuedas q prometimos nunca llorar por un hombre?. pues no pudimos cumplir esa promesa...,1,Negativo,-0.296
Si cumplimos nuestro sueño de estar con una Milf,1,Neutral,0.0
Ubicate,1,Neutral,0.0
Hdp no le hables,1,Negativo,-0.296
No retires tus Bitcoin ! Aweonao !!!! 🥹,1,Negativo,-0.5216
Deja la computadora,1,Neutral,0.0
"Anímate, tu vida cambiará drásticamente así que anímate y piensa si lo que haces hoy cambiará al mundo o tu entorno",1,Neutral,0.0
Vende todas las criptos,1,Neutral,0.0
Jugale al 36,1,Neutral,0.0
"No gastes ese dinero, pendejo.",1,Negativo,-0.296
"Debiste renunciar antes que te hicieran supervisor, ahora ve el desmadre que tenemos por culpa del pendejo de Curi en totalplay",1,Neutral,0.0
"*golpe en las pelotas*  Ahora que tengo tu atención, no confíes plenamente en nadie, no te aferres a aquello que no te ayuda a progresar ni a quien diga motivarte. Confía más en ti y nunca dejes lo que te apasiona ni te sacrifiques por la tranquilidad de otros",1,Negativo,-0.6808
Ahorra,1,Neutral,0.0
"Aprovecha tus 20s, deja los vicios y enfócate en el ejercicio, deporte y aprendizaje. Ve al psicólogo más adelante lo agradecerás.

No te tomes nada personal que venga de los demás. No seas tan cruel con tus papás.

Confía más en ti.",1,Negativo,-0.802
No te cases con Gayman Dildo Verga Pussy,1,Negativo,-0.296
Yo le diría: ponte las pilas malparido que ya vamos tarde hacia el éxito,1,Neutral,0.0
Hola,1,Neutral,0.0
no le metas 350 dólares a la cuenta de psn :v,1,Negativo,-0.296
"No respondas esa llamada, el concurso no valdrá la pena",1,Negativo,-0.5267
"No se cómo te iba tan bien en la escuela, bueno pos eras de primaria y ahora ya vas a prepa 😮‍💨",1,Negativo,-0.296
Algo(porque la imagen dice “dile algo”),1,Neutral,0.0
"me diría a mi mismo que baje de peso, aunque hubiera sido vomitando o restringiendome o autolesionandome, hubiera preferido eso que ser un gordo pendejo ahorita",1,Neutral,0.0
Besala mina,1,Neutral,0.0
Aléjate del porno.,1,Neutral,0.0
Invertir,1,Neutral,0.0
"Rapate a partir de ahora que te vas a quedar calvo igual, que te valga todo, estudia y no te hagas amigo de gente pendeja.",1,Negativo,-0.296
No procrastines más y empieza a enfocarte más a los estudios,1,Negativo,-0.296
Pisting is life,1,Neutral,0.0
Tiene el mejor trabajo no renuncie,1,Negativo,-0.296
dile a yurii que no mame,1,Negativo,-0.296
"No te enamores de ella, no la conozcas, en aquella estación de bus, no aceptes su indicación, y no tomes el mismo bus que ella esa noche.",1,Negativo,-0.7783
Vete ya de ahí,1,Neutral,0.0
Eres un idiota y siempre lo serás no debiste confiar tanto en ti mismo.....,1,Negativo,-0.296
Querido yo no vuelvas a dejar que te lastimen como lo hicieron 🥀,1,Negativo,-0.296
Ponte verga y ten paciencia,1,Neutral,0.0
Puto el que se rinda 🤙,1,Neutral,0.0
La cagaste con la calificación (fracasado),1,Neutral,0.0
Qué nunca abandoné el colegio,1,Neutral,0.0
Compra dólares y no los vendas,1,Negativo,-0.296
Hoal,1,Neutral,0.0
El aguacate sabe a pene limpio,1,Neutral,0.0
"No dejes de comer por nada del mundo, perder 40 kilos en dos semanas no es nada lindo.",1,Negativo,-0.5267
La desesperación no la puedes cobrar jodiendote el cuerpo ni la mente...,1,Negativo,-0.296
no vayas al indu,1,Negativo,-0.296
Comprá dólares,1,Neutral,0.0
" No seas ambicioso, todo a su tiempo, con base a trabajo, relaciones, estudia, no seas pendejo inmaduro",1,Negativo,-0.5267
No la ames por que saldrás peor que antes de estar con ella.,1,Negativo,-0.296
"No la engañes, ella era la indicada",1,Negativo,-0.296
compra oro.,1,Neutral,0.0
"No vale la pena sufrir por eso, sigue tu camino y logra tus sueños, lo lograrás antes de lo que te imaginas",1,Negativo,-0.296
hermano... deje de hacerse el mrca... e invierta en bitcoin hptaa,1,Neutral,0.0
"Aún puedes arreglar esto, solo esfuérzate.",1,Neutral,0.0
Aprendé a invertir,1,Neutral,0.0
"cuando te diga de entrar a su habitación, no entres XD",1,Positivo,0.516
"Yo le diria: ""Viste esa chica que conociste en cuarto año de la secundaria? Aléjate de ella simplemente aléjate se que estas enamorado pero es mejor que te lajes es lo mejor""",1,Neutral,0.0
"Enfocate en ese proyecto. No vale la pena desvivirte por quien esta cerca de entrar en tu vida. Aunque lo creas, no valdrá la pena pasar por tanto calvario y tanto infierno, no podrás curarla, aléjate porque explotará en tu cara y se llevará tu futuro, tu trabajo, tu dinero, hasta tu 2da carrera.
Enfocate en ti, priorizate, y no le creas todo. Everybody lies. 
Recuerda el pasado, sé fuerte, dolerá, pero tienes que levantarte.",1,Negativo,-0.8625
M*t*t* no hay salida.,1,Negativo,-0.296
Compra dólares,1,Neutral,0.0
Ya sé que cómo chingo con eso pero ahorra...,1,Neutral,0.0
"Deja eso que estas haciendo, no dara frutos y solo te hara infeliz, suelta y se feliz...",1,Negativo,-0.296
Espabila hija de puta,1,Neutral,0.0
"Aprende inglés de una vez, que esperas wey?",1,Neutral,0.0
Yo no te jales tanto que ahora ya estoy ciego,1,Negativo,-0.296
I still keep my desire to get out of this country xddd,1,Positivo,0.4019
Las personas que te mienten no te aman.,1,Negativo,-0.296
"Aléjate de Melissa, CABRON",1,Neutral,0.0
"Ve tranquilo bro, no te dejes llevar y no le hagas tanto caso a ella",1,Negativo,-0.5267
"Se una buena pareja para la persona que tienes a lado, piensa antes de actuar, dale el tiempo y el lugar que se merece, no reprimas tus sentimientos hacia ella, vive  y disfruta cada momento con ella. 
Ah y has una maestría o aprende a hacer ecografias y ahorra",1,Negativo,-0.296
"No te inyectes cocaína, terminarás cuckeado",1,Negativo,-0.296
"Ella no está, estará o estuvo disponible para ti, no permitas que vuelva a pasar, no es tu amiga, no se alegra de tenerte en su vida, se alegra de tener un paño de lágrimas con solo tronar los dedos, imbécil!!!",1,Negativo,-0.826
No la dejes ir!,1,Negativo,-0.3595
"Compra criptomonedas y vendelas en 2020.
😎👍",1,Neutral,0.0
Que pasa causa??? Gaaaaa,1,Neutral,0.0
"""Haces muy bien en NO ponerte ese Veneno de Pfizer"".",1,Negativo,-0.4466
"El de hace 7 años era un pendejo completamente, hijo de puta.....",1,Neutral,0.0
"Ya falta media botella.. vete a tu casa, no esperes que se termine..",1,Negativo,-0.296
Comprá bitcoin,1,Neutral,0.0
"Tods declaracion de amor es urgente, independientemente de si es correspondido o no, porque ambos morirán y el amor no expresado es igual a nunca haber amado, porque ella morirá, no la habras hecho sentir amada y ese amor morirá contigo, es egoista no expresar el amor que sientes por alguien, esa persona merece saberlo, es desicion de ella corresponder o no, pero es tu obligacion expresarlo
ella morirá y no le habras dado la oportunidad de decidir o de al menos sentir que alguien daria la vida por ella y le dedicaria el trabajo de su vida
eres un cobarde y un egoista si no le dices",1,Positivo,0.6808
gordo de mrd haz ejercicio,1,Neutral,0.0
Mátate,1,Neutral,0.0
Aprende Excel,1,Positivo,0.4588
Todo va a malir sal,1,Neutral,0.0
"El tiempo no espera a nadie. Nunca será el momento perfecto
Hazlo ya.",1,Positivo,0.0258
No entres a trabajar en HFI,1,Negativo,-0.296
No te metas eso por el culo,1,Negativo,-0.296
matate.,1,Neutral,0.0
No compres casa es una trampa,1,Negativo,-0.296
"Disfruta de cada momento pero responsable; no la dejes ir ella es para ti; reúne cada centavo y compra acciones/bitcoin, Lee más libros y esfuérzate cada día",1,Negativo,-0.296
Ahorra los dólares,1,Neutral,0.0
"“Salte de trabajar de ahí, estás a tiempo”.",1,Neutral,0.0
"volvé a estudiar.

Abandona a tu familia, te están usando y te dejaron clavado con un familiar peso muerto.

Salí del ciclo de depresión y habla con gente.

No comas tanto, maneja tus emociones.",1,Negativo,-0.296
"No le metas dinero al Fortnite, después te aburres y pierdes $10,000",1,Negativo,-0.296
Anda al dentista. Y al h3morroidologo,1,Neutral,0.0
Dale duro a la vieja esa,1,Neutral,0.0
"Ahorra, y deja de salir con esas que son tibias",1,Neutral,0.0
Qué si marqué al número de emergencias y me abrazaría diciendo que todo saldría bien.,1,Neutral,0.0
Huevos puto,1,Neutral,0.0
"No sé si decir algo de mi yo de esa época o decir algo que el diría pero haré ambas 

Algo que diría 
-la vida es una mierda

Algo de el 
-era un emo seudo gótico cretino pero no tenía ni puta idea de la vida",1,Negativo,-0.5267
Debí saber decir NO más veces,1,Negativo,-0.4466
"Tómalo con calma, solo es una etapa mala en la vida después viene la abundancia y los buenos tiempos",1,Neutral,0.0
"Ve perdiendo la esperanza, aun no la has puesto y no la vas a poner jajajaja",1,Negativo,-0.5267
"Deja el estudio. Deja de gastar el poco dinero que tenés en ir a clases y querer terminar la carrera, primero tenés que enfocarte en tener un trabajo, acomodarte, remodelar tu casa y cuando estés mejor ahí si dedicarte a estudiar y terminar la carrera... Por no haber echo eso es como desde 2019 no eh podido terminar los estudios, vivo solo desde los 17 y siempre fue una lucha sin fin.",1,Negativo,-0.7906
“No gastes esos 60 dolares”,1,Neutral,0.0
Suicidate 💕,1,Neutral,0.0
"Si te hace reir mucho, te va meter el pito",1,Neutral,0.0
pajero,1,Neutral,0.0
"Cuando encuentres a Lisa, no la dejes ir... porque te pesará",1,Negativo,-0.296
Eres una verga,1,Neutral,0.0
"No te preocupes hombre, no fue tu culpa lo que le paso. No podias hacer nada. Hay que ser mas pragmaticos y ver por nosotros mismos.

Solo empieza a dormir bien y estudiar por internet de una vez, tenemos que irnos de aqui lo antes posible.",1,Negativo,-0.6808
Suicidarte ..no vale la pena lo que sigue,1,Neutral,0.0
No te enamores,1,Negativo,-0.296
Es muy pesada la carga pero estarás bien te lo aseguro,1,Neutral,0.0
"Cogetela, al final de todas formas todo va a valer madres...",1,Neutral,0.0
"no escuches a mama,sali  DE ESA CARRERA",1,Negativo,-0.296
"Recuerda que lo pendejo se queda, estudia pendejo",1,Neutral,0.0
"Compra oro, vende un riñón, estaremos bien, pero compra todo el oro que puedas",1,Neutral,0.0
"Que estudie mas lo que quiere sobre la universidad y administre sus pasiones con las otras, para que asi consiga mas efectividad, y le recordaria que el colegio no dura para siempre afortunadamente.",1,Negativo,-0.296
No metas tu plata ahí,1,Negativo,-0.296
3 años no es suficiente,1,Negativo,-0.296
No pidas o aceptes ningún crédito bancario,1,Negativo,-0.296
Pajero,1,Neutral,0.0
Aun sigo vivo parcero,1,Neutral,0.0
"Si le advirtiese de algo, se convertiría en algo que hoy no soy. Supongo que solo le desearía suerte, le daría las gracias y le diría que es mucho menos inteligente de lo que cree, que eso da igual y siempre lo dará, que siga caminando y escuchando, que quiera y conozca más todavía a la gente, que predique menos sermones y no tenga tanto miedo a pasarlo mal. Eso le diría yo y estoy seguro de que es lo mismo que me dirá mi yo del futuro",1,Negativo,-0.5267
"Tu imaginación no llega a lo que viene para ti, felicidades",1,Negativo,-0.296
"Ahora todo está bien, después no ... Aprovecha, créeme.",1,Negativo,-0.296
Sigue adelante yo creo en ti,1,Neutral,0.0
Apurate en divorciarte,1,Neutral,0.0
Pasa más tiempo con tus padres. Ayúdales en lo que necesiten,1,Neutral,0.0
En 3 años seguimos siendo vírgenes. Y deja el nopor,1,Neutral,0.0
"Eres un pendejo, pero sigue así",1,Neutral,0.0
"AHORRA Y VE A VIVIR SOLA, NO TE CONFIESES A TU MEJOR AMIGO. Eso le diría.",1,Negativo,-0.4466
No aceptés esa tarjeta de crédito idiota jajajaj,1,Negativo,-0.296
"No te fijes en ella solo te va a lastimar, ella miente solo le interesa tu dinero no te ama y te dejará endeudado por un buen tiempo",1,Negativo,-0.5267
"En varias ocasiones he dicho que si pudiera volver atrás, no cambiaría nada de lo que hice, pero eso no significa que no me arrepienta de lo que sucedió...

Escucha: de todas las decisiones y cosas que han ocurrido en los últimos 3 años, mi consejo sería que busques a esta chica antes del 2023. No lo digo porque piense que eso te va a dar una oportunidad para ganarse su corazón; por el contrario mi consejo es no te enamores de ella. Pero quizá, un quizá tan minúsculo, de una probabilidad tan grande como la particular más pequeña, puede que la vida sea un poco mejor para ella.

Si logras acercarte antes de que acabe 2022, entonces en 2023 no pienses en hacer equipo con ella, no revises su trabajo ni te reúnas para corregirlo. Salvate del dolor, del agobio, de las dudas, de las crisis...",1,Negativo,-0.9081
No indagues si no puedes enfrentar la verdad sin derrumbarte,1,Negativo,-0.7906
"""Este trabajo es para estar, no para quedarte""",1,Negativo,-0.296
No trabajes de programador.,1,Negativo,-0.296
